{
  "$schema": "http://json-schema.org/draft-07/schema#",
  "$id": "https://github.com/PostHog/context-mill/releases/latest/download/cli-manifest.schema.json",
  "title": "Wizard CLI manifest",
  "description": "Shape of dist/skills/cli-manifest.json. Published alongside the manifest itself so downstream consumers (notably the wizard's prebuild) can validate the manifest's structure before snapshotting it. The wizard's CONTRIBUTING.md and context-mill's CONTRIBUTING.md cover the field semantics.",
  "type": "object",
  "additionalProperties": false,
  "required": ["version", "buildVersion", "buildTimestamp", "entries"],
  "properties": {
    "version": {
      "type": "string",
      "description": "Schema version. Bumped when the manifest shape changes in a breaking way."
    },
    "buildVersion": {
      "type": "string",
      "description": "Context-mill release version that produced this manifest. May be 'dev', 'bootstrap', or 'empty-fallback' depending on the source."
    },
    "buildTimestamp": {
      "type": "string",
      "minLength": 1,
      "description": "ISO 8601 timestamp the manifest was emitted."
    },
    "entries": {
      "type": "array",
      "items": { "$ref": "#/definitions/CliManifestEntry" }
    }
  },
  "definitions": {
    "CliManifestEntry": {
      "type": "object",
      "additionalProperties": false,
      "required": ["skillId", "surface", "displayName", "description"],
      "properties": {
        "skillId": {
          "type": "string",
          "minLength": 1,
          "description": "Context-mill skill id (e.g. 'audit-events', 'migrate-statsig')."
        },
        "surface": {
          "type": "string",
          "enum": ["public", "catalog", "internal"],
          "description": "Where this skill appears in the wizard CLI surface."
        },
        "command": {
          "type": "string",
          "pattern": "^[a-z][a-z0-9-]*$",
          "minLength": 2,
          "maxLength": 20,
          "description": "User-typed word that registers this skill as a command. Required when surface is 'public'."
        },
        "parentCommand": {
          "type": "string",
          "pattern": "^[a-z][a-z0-9-]*$",
          "minLength": 2,
          "maxLength": 20,
          "description": "Optional parent command this skill nests under."
        },
        "default": {
          "type": "boolean",
          "description": "When true, this leaf runs when the user invokes the family parent with no subcommand (e.g. `wizard audit` runs the leaf marked default). At most one leaf per family may be marked default. Without a default, a multi-child family opens the interactive picker; a single-child family auto-runs its only child."
        },
        "displayName": {
          "type": "string",
          "minLength": 1
        },
        "description": {
          "type": "string",
          "minLength": 1
        }
      }
    }
  }
}
